{
  "cert_id": "test_backup_123",
  "cert_type": "backup",
  "certificate_version": "v1.0.0",
  "created_at": "2023-12-05T14:30:22.123456Z",
  "crypto": {
    "alg": "AES-256-CTR",
    "key_management": "ephemeral_session_key",
    "manifest_sha256": "a1b2c3d4e5f67890123456789012345678901234567890123456789012345678"
  },
  "destination": {
    "fs": "exfat",
    "label": "Backup Drive",
    "mountpoint": "/mnt/backup",
    "path": "/dev/sdb1",
    "type": "usb"
  },
  "device": {
    "bus": "NVMe",
    "capacity_bytes": 1000000000000,
    "firmware": "TEST1.0",
    "logical_block_size": 512,
    "model": "Test SSD 1TB",
    "path": "/dev/nvme0n1",
    "serial": "TEST123456",
    "total_lbas": 1953125000
  },
  "environment": {
    "operator": "test_user",
    "os_kernel": "Linux 6.1.0",
    "tool_version": "v1.0.0"
  },
  "exceptions": {
    "text": "None"
  },
  "files_summary": {
    "count": 100,
    "excluded_paths": [
      "/home/user/.cache"
    ],
    "included_paths": [
      "/home/user/Documents",
      "/home/user/Pictures"
    ],
    "personal_bytes": 500000000
  },
  "issuer": {
    "country": "US",
    "organization": "SecureWipe Test",
    "tool_name": "securewipe",
    "tool_version": "v1.0.0"
  },
  "metadata": {
    "certificate_json_sha256": "a1b2c3d4e5f67890123456789012345678901234567890123456789012345678"
  },
  "policy": {
    "name": "NIST SP 800-88 Rev.1",
    "version": "2023.12"
  },
  "result": "PASS",
  "signature": {
    "alg": "Ed25519",
    "canonicalization": "RFC8785_JSON",
    "pubkey_id": "sih_root_v1",
    "sig": "sX6L/D2B38yp7/92MeKI3AxBc/JucVrQMuIAxeqAD0alSq/ThEAFsuve6yuexkD2PzxOUitG1KpfnObChP13Dg=="
  },
  "verification": {
    "coverage": {
      "mode": "samples",
      "samples": 5
    },
    "failures": 0,
    "samples": 5,
    "strategy": "sampled_files"
  }
}