{
  "cert_type": "backup",
  "cert_id": "TEST_BCK_2024_001",
  "certificate_version": "v1.0.0",
  "created_at": "2025-09-10T03:45:15.829247+00:00",
  "issuer": {
    "organization": "SecureWipe (SIH)",
    "tool_name": "securewipe",
    "tool_version": "v2.1.0",
    "country": "IN"
  },
  "device": {
    "model": "Samsung SSD 980 PRO 1TB",
    "serial": "S6TXNX0R123456",
    "bus": "NVMe",
    "capacity_bytes": 1000204886016,
    "path": "/dev/nvme0n1",
    "firmware": "5B2QGXA7",
    "logical_block_size": 512,
    "total_lbas": 1953525168
  },
  "files_summary": {
    "count": 2847,
    "personal_bytes": 52428800,
    "included_paths": [
      "/home/user/Documents",
      "/home/user/Pictures"
    ],
    "excluded_paths": [
      "/home/user/.cache",
      "/home/user/.tmp"
    ]
  },
  "destination": {
    "type": "usb",
    "label": "BACKUP_USB_2024",
    "fs": "exfat",
    "mountpoint": "/media/backup",
    "path": "/media/backup/securewipe_backup_20240115"
  },
  "crypto": {
    "alg": "AES-256-CTR",
    "manifest_sha256": "d2d2d2d2d2d2d2d2d2d2d2d2d2d2d2d2d2d2d2d2d2d2d2d2d2d2d2d2d2d2d2d2",
    "key_management": "ephemeral_session_key"
  },
  "verification": {
    "strategy": "sampled_files",
    "samples": 142,
    "coverage": {
      "mode": "percent",
      "percent": 15.5
    },
    "failures": 0,
    "notes": "All sampled files verified successfully against manifest hashes"
  },
  "policy": {
    "name": "NIST SP 800-88 Rev.1",
    "version": "2023.12"
  },
  "result": "PASS",
  "environment": {
    "operator": "admin",
    "os_kernel": "Linux 6.8.0-35-generic",
    "tool_version": "v2.1.0",
    "device_firmware": "5B2QGXA7",
    "containerized": false
  },
  "exceptions": {
    "items": [],
    "text": "None"
  },
  "signature": {
    "alg": "Ed25519",
    "pubkey_id": "sih_root_v1",
    "sig": "YWJjZGVmMTIzNDU2Nzg5MGFiY2RlZjEyMzQ1Njc4OTBhYmNkZWYxMjM0NTY3ODkwYWJjZGVmMTIzNDU2Nzg5MA==",
    "canonicalization": "RFC8785_JSON"
  },
  "metadata": {
    "certificate_json_sha256": "a1b2c3d4e5f67890123456789012345678901234567890123456789012345678",
    "logs_sha256": "b2c3d4e5f6789012345678901234567890123456789012345678901234567890",
    "qr_payload": {
      "cert_id": "TEST_BCK_2024_001",
      "issued_at": "2025-09-10T03:45:15.829251+00:00",
      "device_model": "Samsung SSD 980 PRO 1TB",
      "result": "PASS",
      "nist_level": "CLEAR",
      "method": "backup_aes256",
      "sha256_cert_json": "a1b2c3d4e5f67890123456789012345678901234567890123456789012345678",
      "verify_url": "https://verify.securewipe.org/cert/TEST_BCK_2024_001",
      "sig": "YWJjZGVmMTIzNDU2Nzg5MGFiY2RlZjEyMzQ1Njc4OTBhYmNkZWYxMjM0NTY3ODkwYWJjZGVmMTIzNDU2Nzg5MA=="
    }
  },
  "verify_url": "https://verify.securewipe.org/cert/TEST_BCK_2024_001"
}